{
  "id": "booking-process",
  "section": "about",
  "title": "Booking Process",
  "body": "Booking Process\nWe are thrilled that you are considering booking a safari with us.\nDesigning memorable safaris is what we excel at, though we understand that the booking process may be new to some.\nThis page outlines the steps of the booking process, each one crucial to ensuring we create a truly exceptional safari tailored specifically for you.\n\nStep 1 | Initial Contact\nReach out to us by emailing info@mazingirasafari.com or by filling out our online enquiry form or even chatting to us on our web page chat service. Share your travel dates, desired destinations, budget, interests, and what type of experience you’re looking for. Our safari specialist at Mazingira Safari will review your details to fully understand your needs.\nStep 2 | Review Your Options\nYour safari specialist will craft an initial itinerary that includes logistics, lodges, accommodations, and activities. This proposal will give you a clear picture of what to expect from your safari, along with an estimated cost per person.\nStep 3 | Customize Your Journey\nExamine the proposed itinerary and discuss any changes or additional requests with your safari specialist. They will also offer alternative options if needed.\nStep 4 | Add the Finishing Touches\nOnce you're happy with the itinerary, budget, lodges, and activities, we'll finalize the details and prepare a formal quote. We'll also begin securing accommodations and other essential components to ensure availability.\n\nStep 5 | Confirm Your Safari\nConfirm your booking with a 30% deposit, which allows us to contractually secure your accommodations and logistics. We'll keep you informed throughout this process, providing all the necessary details and documentation.\nStep 6 | Pre-Safari Preparations\nAbout two months before your safari, we'll send you a comprehensive travel pack. This includes details about meet and greets, transfers, climate information, health tips, daily travel details, appropriate clothing, contact details while on safari, and emergency contacts.\nStep 7 | Experience Your Safari\nArrive ready to embark on a life-changing safari experience with Mazingira Safari.\nStep 8 | Reflect on Your Journey\nAfter your adventure, you’ll return with unforgettable memories and a piece of Africa in your heart. We cherish your feedback, which helps us maintain and improve our high standards of service. Look out for our follow-up email to share your thoughts.\n\n## Please read our Payment Terms and Conditions here :",
  "images": [
    {
      "src": "https://static.wixstatic.com/media/1ac0ef_6179c700dc0548c7a31bccc08e19cf79~mv2.png",
      "alt": "Mazingira Safaris Eco Friendly Safari Logo"
    },
    {
      "src": "https://static.wixstatic.com/media/11062b_67108b2e3a314391b495b794ff169d3f~mv2_d_2758_1762_s_2.jpg",
      "alt": "national Park Entrance"
    },
    {
      "src": "https://static.wixstatic.com/media/1ac0ef_c6b3aa48f5754806ae45459bf5cddecb~mv2.png",
      "alt": "Booking process diagram for booking a safari through Mazingira Safaris"
    },
    {
      "src": "https://static.wixstatic.com/media/1ac0ef_b0972470d96a482dbaf58190dedd996e~mv2.jpg",
      "alt": ""
    },
    {
      "src": "https://static.wixstatic.com/media/1ac0ef_aea9d2521071435aaa49274427b17209~mv2.jpeg",
      "alt": "Tato Logo"
    }
  ],
  "source": "https://www.mazingirasafari.com/terms-and-condition-payment-process"
}
