{
  "id": "travel-guide",
  "section": "plan",
  "title": "Travel Guide Tanzania",
  "body": "Highlights\n\nTanzania Regions\n\nExplore Tanzania's stunning landscapes and diverse wildlife. Experience the Serengeti's Great Migration, where countless wildebeest, zebra, and gazelle traverse crocodile-filled waters. Visit the Ngorongoro Crater to see the Big Five in a lush setting. Climb Mount Kilimanjaro, Africa’s highest peak, through varied ecosystems. Discover Ruaha and Nyerere National Parks in the south, home to ancient baobabs and unique wildlife encounters.\nEnjoy Zanzibar's white sandy beaches and historic Stone Town, blending relaxation with cultural exploration. Each region in Tanzania offers distinct experiences and breathtaking views, ensuring unforgettable adventures and lasting memories. Whether watching savannah wildlife, trekking through rainforests, or relaxing on tranquil beaches, Tanzania promises to enchant.\n\n## Wildlife\n\nTanzania is home to a significant proportion of Africa's large mammal population, comprising about 20% of the continent's lions, elephants, hippos, giraffes, and notably, the Serengeti's Great Migration wildebeest herds.Beyond these well-known migratory groups, the Serengeti is also renowned for its abundant population of big cats. Additionally, Ruaha National Park in southern Tanzania harbors 10 percent of the global population of wild lions, a key group of cheetahs, and the world's third-largest group of African wild dogs.In the western part of the country, particularly on Rubondo Island, one can observe chimpanzees that are descendants of a group reintroduced from European zoos in the 1960s.\n\nCulture\n\nThere are more than 100 ethnic and tribal groups in Tanzania, including the Maasai and the Hadzabe. Christianity and Islam are the main religions.\nThe official languages are Swahili and English, with indigenous languages interwoven throughout the country —thought to be more than 120 languages in total. Arabic is widely spoken along the coast and in Zanzibar.\n\nGeneral Tips\n\n- Languages: Swahili and English are official\n- Currency: Tanzanian shilling; US dollars accepted in safari camps and lodges.\n- Greeting: Start conversations with a handshake; prolonged hand contact is common.\n- Photography: Ask for permission before photographing people.\n- Dress Code: Casual in safari lodges and beaches; modest in urban areas, covering shoulders and knees.\n- Travel Tips: Consider off-peak travel for lower rates and fewer tourists.\n- Luggage: Limit to one 15kg soft-sided bag due to small plane restrictions.\n- Tipping: Optional; suggested $15-20 per night for guides, $10-15 for camp staff, payable in shillings or US dollars.\n\nCuisine\n\nTanzanian cuisine varies by region, with seafood and spicy flavors common along the coast. Nationwide, the staple Nyama choma (grilled meat) is often served with ugali, made from maize or cassava flour, and accompanied by vegetables like okra and mchicha (similar to spinach), as well as fried plantains. The cuisine also features a notable Indian influence, including dishes like chapati, pilau rice, and biryani.\nSafari camps in Tanzania provide a mix of local and international dishes, including homemade bread, pastries, and fresh salads. Fish and vegetarian options are available on request. Please inform us of any dietary needs.",
  "images": [
    {
      "src": "https://static.wixstatic.com/media/1ac0ef_6179c700dc0548c7a31bccc08e19cf79~mv2.png",
      "alt": "Mazingira Safaris Eco Friendly Safari Logo"
    },
    {
      "src": "https://static.wixstatic.com/media/1ac0ef_d243b999e8804f87bf08d15e1b0472fd~mv2.jpg",
      "alt": "A couple on a Ngorongoro crater rim walk with safari tour guide, with a back drop of the Ngorongoro Crater"
    },
    {
      "src": "https://static.wixstatic.com/media/nsplsh_1e8403750ee34eb2b0ba7f39a97c43af~mv2.jpg",
      "alt": "A photo showcasing the beautiful landscapes of Tanzania, the wonderful Savannah with the back drop of kilimanajaro"
    },
    {
      "src": "https://static.wixstatic.com/media/1ac0ef_5d5a95af98f747acad94b1718ac80f84~mv2.jpg",
      "alt": "A Group of Cheetah shading under the bushes in the vast open plains of the Serengeti one Cheetah is keeping watch"
    },
    {
      "src": "https://static.wixstatic.com/media/nsplsh_6d3431693952634763416f~mv2_d_5184_3456_s_4_2.jpg",
      "alt": "A Maasai Tribe in Tanzania, in there bright red colourful dress showcasing us there singing and jumping dancing tradition"
    },
    {
      "src": "https://static.wixstatic.com/media/1ac0ef_74a1bf05c2734c8c90bb26d6a1d845b7~mv2.jpg",
      "alt": "A Leopard taking a keen interest in our Mazingira Safari Truck, walking slowly behind the truck, breathing heavily"
    }
  ],
  "source": "https://www.mazingirasafari.com/travel-guide"
}
