{
  "id": "big-five",
  "section": "wildlife",
  "title": "BIG CATS",
  "body": "&\nTHE BIG 5\n\nIconic African Animals\n\nTanzania is renowned for offering its guests the chance to spot some of the world’s most iconic animal species.\n\n# THE BIG 5\n\nThe term \"Big Five\" originally refers to the five most challenging animals to hunt on foot in Africa, but today it stands as a checklist for wildlife enthusiasts visiting Tanzania and other parts of the continent. These iconic species—lion, leopard, rhinoceros, elephant, and buffalo—can be found across various Tanzanian national parks, each offering a unique setting for wildlife observation. The vast Serengeti National Park and the Ngorongoro Conservation Area are perhaps the most famous locales for spotting these magnificent creatures in their natural habitats. Here, the expansive savannahs and protective calderas provide ideal conditions for these animals to thrive. The Tarangire National Park is renowned for its elephant population, while the dense, acacia-dotted landscapes of Ruaha are perfect for encountering lions and buffalo. The elusive leopard can often be spotted draped over the branches of a tree in the Serengeti or hidden within the dense foliage of the Ngorongoro highlands. Meanwhile, the critically endangered rhinos are more frequently sighted within the protective confines of the Ngorongoro Crater. Together, these animals form the quintessence of Tanzanian wildlife and are central to the country’s conservation and tourism efforts.\n\n## Rhino\n\nIn Tanzania, the rhinoceros is a majestic yet critically endangered member of the iconic Big Five, found primarily in protected areas such as the Ngorongoro Conservation Area and Serengeti. These prehistoric-looking creatures are revered for their impressive horn and thick, protective skin. Visitors may have the opportunity to spot both black and white rhinos, although the black rhinos are more common and significantly smaller than their white counterparts. Observing these extraordinary animals in their natural habitat is not only a rare and remarkable sight but also a poignant reminder of the conservation efforts necessary to ensure their survival in the wild.\n\nElephants\n\nBuffalo\n\nThe African elephant, the largest land animal on Earth, is an unforgettable sight and another proud member of the Big Five. Tanzania's national parks, particularly Tarangire and Ruaha, are some of the best places in Africa to witness these majestic creatures. With their complex social structures, incredible intelligence, and emotional depth, elephants are known for their strong family bonds and protective behaviors. Observing herds of elephants moving gracefully through the bush, led by a matriarch, offers deep insights into their social lives.\n\nThe African buffalo, one of the most widespread of Tanzania’s Big Five, is known for its raw strength and unpredictable nature, making it a respected and formidable creature in the wild. Herds of these robust animals can predominantly be found grazing in the floodplains of Lake Manyara and the verdant grasslands of Serengeti. Buffaloes are particularly admired for their communal instinct, protecting the sick and old in the herd and collectively facing predators.\n\n### Start Planning Your Trip to See the Iconic Big 5 Now",
  "images": [
    {
      "src": "https://static.wixstatic.com/media/1ac0ef_6179c700dc0548c7a31bccc08e19cf79~mv2.png",
      "alt": "Mazingira Safaris Eco Friendly Safari Logo"
    },
    {
      "src": "https://static.wixstatic.com/media/e772c1307ce84316b164fb0fb03b22ff.jpg",
      "alt": "Lioness"
    },
    {
      "src": "https://static.wixstatic.com/media/1ac0ef_a1943988d5e34c568988778bb518f487~mv2.jpg",
      "alt": "Large Black Rhino in the Ngorongoro Crater, a unique rare animal found on safari in Tanzania"
    },
    {
      "src": "https://static.wixstatic.com/media/1ac0ef_56c2e1e9ba8a4cfd8525add5d648d07d~mv2.jpg",
      "alt": "Male Lion laying happily in the dusty roads of the Serengeti, panting in the sunshine"
    },
    {
      "src": "https://static.wixstatic.com/media/1ac0ef_793038ed7c7d4decb1079628bce64f9e~mv2.jpg",
      "alt": "The Allusive Leopard, resting on a rock on a Tanzania safari"
    },
    {
      "src": "https://static.wixstatic.com/media/1ac0ef_1aa4630866284fad84ec60a2b72fc68e~mv2.jpg",
      "alt": "A large group of elephants including some babies walking through the Serengeti spotted on safari with Mazingira Safari"
    }
  ],
  "source": "https://www.mazingirasafari.com/big-5"
}
