{
  "id": "kilimanjaro-packing-list",
  "section": "kilimanjaro",
  "title": "Kilimanjaro Packing Guide",
  "body": "### What to Pack for Your Kilimanjaro Climbing Trip\n\nEmbarking on a journey to climb Mount Kilimanjaro is an adventure of a lifetime. To ensure you have a successful and enjoyable ascent, proper preparation is key—starting with what you pack. Here’s our detailed guide on what to bring for your climb, complete with tips and advice to enhance your experience. Don’t forget, after you're packed and ready, book your climbing trip with us!\n#### Essential Clothing\n- Base Layers: Breathable and moisture-wicking materials work best. Pack both light and warm layers.\n- Insulation Layer: A down jacket or a synthetic insulated jacket will help keep you warm during the cold nights and higher altitudes.\n- Outer Layer: Waterproof and windproof jackets and pants are crucial for protection against the elements.\n- Footwear: Waterproof, sturdy hiking boots are a must, along with several pairs of hiking socks to keep your feet dry.\n- Headgear: Bring a brimmed hat for sun protection and a warm beanie for cold nights.\n- Handwear: Waterproof gloves are essential, especially as you approach the summit.\n#### Gear and Equipment\n- Backpack: A 35-40 liter backpack should suffice for your day pack, and a larger duffel or backpack for your main gear, which the porters will carry.\n- Sleeping Bag: A sleeping bag rated for at least -10 degrees Celsius to handle the freezing temperatures at higher camps.\n- Headlamp: A reliable headlamp and extra batteries are crucial for early morning starts, especially for the summit attempt.\n- Trekking Poles: These can significantly reduce the impact on your knees and improve your stability on the trail.\n#### Health and Hygiene\n- Sunscreen and Lip Balm: The sun can be intense at high altitudes, so high SPF sunscreen and lip balm with sun protection are must-haves.\n- First Aid Kit: Include altitude sickness medication, pain relievers, bandages, and any personal medications.\n- Water Purification Tablets: Keeping hydrated is critical, and clean water is a must.\n- Toiletries: Pack biodegradable soap, toothpaste, toothbrush, and wet wipes for basic hygiene maintenance.\n#### Nutrition and Snacks\n- Energy Bars and Snacks: High-energy snacks are great for quick fuel on the trail.\n- Electrolytes: Powdered electrolyte mixes can help maintain your body’s mineral balance.\n#### Miscellaneous\n- Camera: Don’t forget a camera or a smartphone with a good camera to capture the breathtaking views.\n- Plastic Bags: Useful for keeping your electronics and important documents dry.\n- Passport, Visa, and Insurance: Ensure your passport is valid, visa requirements are met, and travel insurance is up to date.\n\n### Final Tips\n\n- Pack Light: Remember, you have to carry your day pack, and porters will carry up to a certain weight limit in your duffel.\n- Layering is Key: The weather on Kilimanjaro can change rapidly; layering allows you to adjust your body temperature easily.\n- Check Gear Before You Go: Make sure all your equipment is in good working order before you leave.\n\nReady to take on Kilimanjaro? Contact Us to choose the route and dates that best fit your adventure. Safe travels and happy climbing!",
  "images": [
    {
      "src": "https://static.wixstatic.com/media/1ac0ef_6179c700dc0548c7a31bccc08e19cf79~mv2.png",
      "alt": "Mazingira Safaris Eco Friendly Safari Logo"
    },
    {
      "src": "https://static.wixstatic.com/media/1ac0ef_95c3a940c8d648c096e312b2fa962817~mv2.png",
      "alt": "Camping and hiking gear laid our on the grass to display an idea of what to pack for a Kilimanjaro climbing tour in Tanzania"
    },
    {
      "src": "https://static.wixstatic.com/media/1ac0ef_2c2e9ef3af55424abd0504424764f369~mv2.png",
      "alt": "Kilimanjaro scene photo, with beautiful blue skies on a summer day against the beautiful green trees."
    },
    {
      "src": "https://static.wixstatic.com/media/1ac0ef_aea9d2521071435aaa49274427b17209~mv2.jpeg",
      "alt": "Tato Logo"
    }
  ],
  "source": "https://www.mazingirasafari.com/kilimanjaro-packing-guide"
}
