{
  "id": "visas-and-entry",
  "section": "plan",
  "title": "Visas & Entry Requirements,",
  "body": "### Visa and Entry Requirements for Tanzania\n\n1. Visa Requirements:\n- General Requirement: Most travelers require a visa to enter Tanzania. Visitors should check specific requirements based on their country of origin.\n- Types of Visas:\n- Tourist Visa: Generally valid for 90 days for tourists visiting for leisure.\n- Business Visa: For short-term business, meetings, or conferences.\n- Transit Visa: For travelers passing through Tanzania en route to another destination.\n- Visa Application:\n- E-Visa: Travelers can apply for an e-visa via the official Tanzania Immigration website, which is recommended to simplify the entry process.\n- Visa on Arrival: Available at major entry points like Julius Nyerere International Airport (Dar es Salaam), Kilimanjaro International Airport, and Zanzibar International Airport. Obtaining an e-visa in advance is advisable to avoid delays.\n- Embassy Visa: Can be obtained at Tanzanian embassies or consulates in the home country.\n2. Entry Requirements:\n- Passport Validity: Passports must be valid for at least six months after the date of entry.\n- Return Ticket: Proof of a return ticket or onward journey may be required.\n- Vaccination:\n- Yellow Fever: A vaccination certificate is necessary if coming from or transiting through a country with risk of Yellow Fever.\n- COVID-19: Check the latest health guidelines for any COVID-19 related entry requirements.\n- Financial Proof: Evidence of sufficient funds to cover the stay may be requested.\n3. Health Precautions:\n- Malaria Prevention: Malaria is prevalent in Tanzania. It is highly recommended to take malaria prophylaxis. Consult with a healthcare professional to discuss appropriate malaria medication and other travel health advice well before your trip.\n- Health Insurance: Travel health insurance is recommended to cover any medical expenses.\n4. Special Considerations:\n- Zanzibar: Note that Zanzibar operates under different local regulations and may have additional entry requirements.\n5. Additional Tips:\n- Stay Informed: Visa policies and entry requirements can change. Regularly check updates from the Tanzania Immigration Service or consult the nearest Tanzanian embassy or consulate before traveling.\nThese guidelines offer a comprehensive overview, but travelers should ensure they check the latest information and consult health professionals for specific travel health advice.",
  "images": [
    {
      "src": "https://static.wixstatic.com/media/1ac0ef_6179c700dc0548c7a31bccc08e19cf79~mv2.png",
      "alt": "Mazingira Safaris Eco Friendly Safari Logo"
    },
    {
      "src": "https://static.wixstatic.com/media/11062b_161218b34ad54c76bee91294f8ac2430~mv2.jpeg",
      "alt": "Travel Blog"
    },
    {
      "src": "https://static.wixstatic.com/media/1ac0ef_aea9d2521071435aaa49274427b17209~mv2.jpeg",
      "alt": "Tato Logo"
    }
  ],
  "source": "https://www.mazingirasafari.com/visa-info"
}
