{
  "id": "what-to-pack",
  "section": "plan",
  "title": "Packing Tips For Safari",
  "body": "### What to Pack for a Safari in Tanzania: Essentials & Tips for a Zanzibar Add-On\n\nEmbarking on a safari in Tanzania offers a chance to witness the breathtaking beauty and diverse wildlife of Africa. Whether you're planning to traverse the vast plains of the Serengeti or ascend the heights of Mount Kilimanjaro, packing the right items is crucial for a comfortable and successful adventure. Here’s your ultimate guide to packing for a safari in Tanzania, with a bonus section for those extending their trip to the tropical paradise of Zanzibar.\n#### Essential Safari Packing List\n\n1. Clothing:\n- Lightweight, Breathable Fabrics: Opt for neutral colors (tan, brown, khaki, olive) to blend with the natural environment and avoid attracting insects.\n- Long Sleeves and Pants: These protect against the sun and insects, especially mosquitoes that are prevalent at dawn and dusk.\n- Warm Layers: Nights and early mornings can be chilly, especially at higher altitudes or during the cooler months. Include a warm fleece or jacket.\n- Rain Gear: A lightweight waterproof jacket will come in handy during the rainy season.\n2. Footwear:\n- Sturdy Walking Shoes: A comfortable pair of hiking boots or walking shoes is essential for those walking safaris or any extensive walking.\n- Sandals: For more casual wear around the camp or lodge.\n3. Gear and Equipment:\n- Binoculars: Enhance your wildlife viewing experience with a good pair of binoculars.\n- Camera Equipment: Bring a camera with a good zoom lens to capture distant wildlife, along with extra batteries and memory cards.\n- Sun Protection: Pack sunglasses, a wide-brimmed hat, and high SPF sunscreen to protect against the strong African sun.\n- Insect Repellent: Essential for protecting against mosquito bites, which can transmit diseases such as malaria.\n4. Health and Safety:\n- First Aid Kit: Include basic supplies and any personal medications. Anti-diarrheal medications and electrolytes are useful for stomach upsets.\n- Travel Insurance Information: Always carry information about your travel insurance.\n5. Miscellaneous:\n- Daypack: For carrying essentials during game drives or short walks.\n- Reusable Water Bottle: Stay hydrated without increasing plastic waste.\n- Guidebooks and Wildlife Guides: Enhance your understanding and enjoyment of the environments and animals you are observing.\n#### Importance of Packing Light\n\nWhy Pack Light?\n- Mobility: Lighter packs make moving through airports, transferring between vehicles and lodges, and managing your belongings on game drives much easier.\n- Flight Restrictions: Many safari flights have strict weight limits, typically around 15kg per person for checked luggage. Overpacking can lead to extra fees or the inconvenience of leaving items behind.\n- Simplicity: Fewer items mean less to worry about. Simplifying your gear lets you focus more on the experience than managing your belongings.\nAdvantages of a Hiking Backpack:\n- Flexibility: Hiking backpacks are easier to fit into small spaces like overhead compartments or safari vehicles, compared to hard-sided luggage.\n- Comfort: Adjustable straps and designed ergonomics make carrying a backpack more comfortable over distances or uneven terrain.\n- Accessibility: Quick access to pockets and compartments can be invaluable during transit or when you need to grab items on the go.\n\n#### Bonus Item: What to Pack for a Zanzibar Add-On\n\nAfter your safari, if you're heading to Zanzibar, you’ll want to adapt your packing list for the beach and historical explorations:\n- Swimwear: Essential for enjoying the beautiful beaches.\n- Light, Airy Clothing: Perfect for the hot and humid climate. Include a few conservative options for visiting Stone Town, where modesty is appreciated.\n- Flip Flops and Water Shoes: Ideal for sandy beaches and exploring the coral reefs.\n- Snorkeling Gear: Bring your own if you prefer to use equipment that fits you well.\n- Cover-Up or Sarong: Useful for beach lounging and as an additional layer of sun protection.\n#### Final Thoughts\n\nPacking effectively for a Tanzanian safari and a Zanzibar getaway involves preparing for a variety of activities and climates. By covering the essentials listed above and packing lightly in a versatile backpack, you’ll be well-equipped to enjoy every moment of your African adventure, from the wild savannahs to the serene beaches of Zanzibar. Happy travels!",
  "images": [
    {
      "src": "https://static.wixstatic.com/media/1ac0ef_6179c700dc0548c7a31bccc08e19cf79~mv2.png",
      "alt": "Mazingira Safaris Eco Friendly Safari Logo"
    },
    {
      "src": "https://static.wixstatic.com/media/1ac0ef_3629221df2fc4e79973809ae714e67e3~mv2.png",
      "alt": "Two large safari backpacks resting on a hill in Tanzania"
    },
    {
      "src": "https://static.wixstatic.com/media/1ac0ef_c415bb8f1f734d25b750646073a8b04a~mv2.png",
      "alt": "Why pack light for Safari image"
    },
    {
      "src": "https://static.wixstatic.com/media/1ac0ef_f81a1bed614f4bfcb8170ee978107f74~mv2.png",
      "alt": "Why pack light for Safari image"
    },
    {
      "src": "https://static.wixstatic.com/media/1ac0ef_fb916289cf1b40bca0af451dfdb5e51b~mv2.png",
      "alt": "Why pack light for Safari image"
    },
    {
      "src": "https://static.wixstatic.com/media/nsplsh_6550655473716379556949~mv2_d_4096_2640_s_4_2.jpg",
      "alt": "Zanzibars white beaches and blue seas are show at the edge of the island"
    }
  ],
  "source": "https://www.mazingirasafari.com/what-to-pack"
}
