{
  "id": "kilimanjaro",
  "section": "kilimanjaro",
  "title": "Kilimanjaro",
  "body": "Your Kilimanjaro Adventure\n\nNestled within the Eastern Rift Mountains just south of the equator, Mount Kilimanjaro's majestic snow-capped peaks offer a stunning contrast to the expansive plains below. Known as the \"Roof of Africa,\" climbing Kilimanjaro's peak at 5,895 meters (19,341 feet) represents not only a physical challenge but also a profound journey that tests the limits of human endurance and spirit.\n\nFor those seeking a transformative adventure coupled with the prestige of conquering Africa’s highest mountain, consider integrating a Kilimanjaro climb into your East African safari with us. We recommend the less frequented Lemosho and Rongai routes for a more serene and picturesque experience. These paths offer a quieter, more intimate encounter with Kilimanjaro's diverse environments, away from the bustling crowds found on more popular routes. Our partnerships with top-tier operators and seasoned guides ensure a personalized and safe expedition in this awe-inspiring natural setting.\nAbout Kilimanjaro\nKilimanjaro is a dormant volcano composed of three volcanic cones—Kibo, Mawenzi, and Shira—making it not only Africa’s tallest peak but also the highest freestanding mountain globally. Unlike other renowned peaks among the Seven Summits, climbing Kilimanjaro does not require advanced technical mountaineering skills. However, it demands good physical fitness and preparation, as the climb is challenging. Most ascents span six to eight days, and we advise taking the longer duration to allow for better acclimatization to the varying altitudes and climates you'll encounter. Starting in the lush rainforest filled with rich flora and fauna, the ascent through five distinct climate zones culminates in the stark beauty of the summit's ice cap, offering climbers a truly unique and memorable experience.\n\nStart your Kilimanjaro Adventure Now",
  "images": [
    {
      "src": "https://static.wixstatic.com/media/1ac0ef_6179c700dc0548c7a31bccc08e19cf79~mv2.png",
      "alt": "Mazingira Safaris Eco Friendly Safari Logo"
    },
    {
      "src": "https://static.wixstatic.com/media/nsplsh_6942c4e692dc4441b493d142c2ad5560~mv2.jpg",
      "alt": "Image by Crispin Jones"
    },
    {
      "src": "https://static.wixstatic.com/media/nsplsh_445758522d6e416278436b~mv2_d_3043_2036_s_2.jpg",
      "alt": "Image by Sergey Pesterev"
    },
    {
      "src": "https://static.wixstatic.com/media/1ac0ef_aea9d2521071435aaa49274427b17209~mv2.jpeg",
      "alt": "Tato Logo"
    }
  ],
  "source": "https://www.mazingirasafari.com/kilimanjaro"
}
