{
  "id": "terms-and-conditions",
  "section": "legal",
  "title": "Payment Terms & Conditions",
  "body": "Booking and Payment Terms for Mazingira Safaris\nBooking Confirmation:\nTo confirm your booking, please provide confirmation either via email to Mazingira Safaris or directly through our itinerary form, which links directly to the payment page. This confirmation must be in writing to ensure clarity and mutual understanding of the booking details.\nPayment Methods:\n- Online Payment Portal: Payments can be made securely through our online payment portal using either credit or debit card.\n- Bank Transfer: Alternatively, payments can be made by bank transfer. Bank details are provided with your written quote; always confirm them with us by phone before paying.\n\nPayment Schedule:\n- 30% deposit to secure the booking.\n- An additional 40% is due 8 weeks prior to travel.\n- The remaining 30% must be paid 30 days before the tour begins.\n- Please ensure timely payments to secure your reservation. Late payments will result in cancellation of the booking and loss of deposit. Early bookings are encouraged to guarantee availability.\nPayments from overseas and non-residents of Tanzania should be made in US Dollars. Residents of Tanzania may pay in the local currency at the current exchange rate at the time of payment. Mazingira Safaris reserves the right to withhold services if payments are not made according to the specified conditions.\nSafari Pricing:\nPrices are quoted in US Dollars per person, based on double occupancy, and include full board during safari days. Pricing for a private safari with two people includes a private vehicle and guide. Prices vary depending on the choice of lodges and camps, the season, and the specific dates of your trip. Our prices exclude international flights but include all transfers, internal flights, and land arrangements. Departures are guaranteed without the need to join fixed groups.\nWhen planning your budget, please communicate your financial considerations clearly to your Mazingira Safaris consultant. Let us know your preferred safari program, and we will provide a detailed itinerary and our best quotation tailored to your budget and requirements.\nLate Bookings:\nFor reservations made within 40 days prior to the commencement of the safari, full payment is required at the time of booking.\nCancellation Policy:\nTo cancel a confirmed booking, notification must be made in writing to Mazingira Safaris. The following cancellation fees will apply from the date your written notification is received:\n- More than 61 days prior to departure: 20% of the package price.\n- 60 to 45 days prior to departure: 50% of the package price.\n- 44 to 31 days prior to departure: 70% of the package price.\n- 30 days or less prior to departure or after the safari has commenced: 100% of the package price; no refunds will be issued for cancellations made within this period or once the safari has started.\nImportant Information:\nThere are no refunds for any unused portion of the safari once it has commenced. Cancellation penalties or additional costs incurred from changes in airline schedules or airfares are not included in the above cancellation fees and must be handled directly with the involved airlines. We recommend purchasing cancellation insurance to cover the total cost of the safari.\nFor any inquiries or further assistance, please contact us at info@mazingirasafari.com.",
  "images": [
    {
      "src": "https://static.wixstatic.com/media/1ac0ef_6179c700dc0548c7a31bccc08e19cf79~mv2.png",
      "alt": "Mazingira Safaris Eco Friendly Safari Logo"
    },
    {
      "src": "https://static.wixstatic.com/media/99ec98fdb81945c29c25a3ad6c5606b1.jpg",
      "alt": "Mountain range with a hazy weather above"
    },
    {
      "src": "https://static.wixstatic.com/media/1ac0ef_aea9d2521071435aaa49274427b17209~mv2.jpeg",
      "alt": "Tato Logo"
    }
  ],
  "source": "https://www.mazingirasafari.com/terms-conditions"
}
