{
  "id": "best-time-to-visit-tanzania-for-a-safari",
  "section": "plan",
  "title": "Best Time to Visit Tanzania for a Safari",
  "body": "Planning a safari in Tanzania is an exciting adventure, but choosing the best time to visit can make a significant difference in your experience. Tanzania, home to some of the most iconic wildlife reserves in the world, offers unique experiences throughout the year. Here's a comprehensive guide to help you decide the best time to embark on your Tanzanian safari adventure, highlighting different seasons, their benefits, and what wildlife and experiences you can expect.\n\nDry Season (June to October)\n\nWhy Visit During the Dry Season?\n\nThe dry season, from June to October, is often considered the best time to visit Tanzania for a safari. The weather is sunny, with minimal rainfall, making it easier to spot wildlife. The vegetation is sparse, and animals gather around waterholes and rivers, providing excellent game viewing opportunities.\n\nWildlife and Experiences:\n\nGreat Migration: Witness the spectacular Great Migration in the Serengeti, where millions of wildebeest and zebras move in search of greener pastures. The river crossings at Grumeti and Mara Rivers are particularly thrilling.\n\nBig Five Sightings: The Serengeti and Ngorongoro Crater are prime locations to see the Big Five – lions, leopards, elephants, rhinos, and buffaloes.\n\nBird Watching: While some migratory birds leave, resident bird species are abundant, making it a good time for bird watching.\n\nGreat Migration (October 2023)\n\nShort Rainy Season (November to December)\n\nWhy Visit During the Short Rains?\n\nThe short rainy season in Tanzania, from November to December, brings brief showers, often in the late afternoon. This period is less crowded, offering a more private safari experience.\n\nWildlife and Experiences:\n\nGreen Landscapes: The rains rejuvenate the landscape, making it lush and green, perfect for photography.\n\nBaby Animals: This is the calving season for many animals, including wildebeest, leading to an increase in predator activity.\n\nMigratory Birds: The arrival of migratory birds from Europe and Asia makes it an excellent time for bird enthusiasts.\n\nLong Rainy Season (March to May)\n\nWhy Visit During the Long Rains?\n\nThe long rainy season, from March to May, is the least popular time for safaris, but it has its advantages. This period sees fewer tourists, lower prices, and the parks are less crowded.\n\nWildlife and Experiences:\n\nLush Scenery: The heavy rains transform the landscapes into a vibrant green, offering breathtaking scenery.\n\nExclusive Experience: With fewer tourists, you can enjoy a more intimate and personalized safari experience.\n\nBird Watching: This is a peak time for bird watching, with a variety of species in full breeding plumage.\n\nShoulder Seasons (January to February)\n\nWhy Visit During the Shoulder Seasons?\n\nThe shoulder seasons, particularly January and February, offer a balance between the dry and rainy seasons. The weather is relatively dry, with occasional showers, making it a great time for safaris.\n\nWildlife and Experiences:\n\nCalving Season: In the southern Serengeti, the wildebeest calving season attracts predators, providing dramatic wildlife action.\n\nMild Weather: The temperatures are warm but not extreme, making it comfortable for game drives and outdoor activities.\n\nDiverse Wildlife: A variety of animals, including predators and their prey, are more visible in the short grass plains.\n\nFinal Thoughts\n\nChoosing the best time to visit Tanzania for a safari depends on what you want to experience. The dry season offers unparalleled wildlife viewing and the excitement of the Great Migration. The short rainy season brings beautiful landscapes and baby animals. The long rainy season provides solitude and vibrant scenery. Meanwhile, the shoulder seasons offer a mix of benefits from both the dry and rainy periods.\n\nNo matter when you choose to visit, a safari in Tanzania promises unforgettable encounters with nature's wonders. Plan your trip according to your interests, and prepare for an adventure of a lifetime.",
  "images": [
    {
      "src": "https://static.wixstatic.com/media/1ac0ef_6179c700dc0548c7a31bccc08e19cf79~mv2.png",
      "alt": "Mazingira Safaris Eco Friendly Safari Logo"
    },
    {
      "src": "https://static.wixstatic.com/media/1ac0ef_87947d6d66644485832dec24913c915b~mv2.png",
      "alt": ""
    },
    {
      "src": "https://static.wixstatic.com/media/1ac0ef_12c6f340d3b1490b947901b9ac46c676~mv2.jpg",
      "alt": ""
    },
    {
      "src": "https://static.wixstatic.com/media/1ac0ef_799b9addca054049bb2d0f932b08beae~mv2.png",
      "alt": ""
    }
  ],
  "source": "https://www.mazingirasafari.com/post/best-time-to-visit-tanzania-for-a-safari"
}
