{
  "id": "about-us",
  "section": "about",
  "title": "About Mazingira",
  "body": "Welcome to Mazingira Safaris, where your journey into the heart of Tanzania begins! At Mazingira Safaris, we specialize in creating unforgettable safari experiences that immerse you in the stunning landscapes and diverse wildlife of one of Africa's most breathtaking destinations. Our name, 'Mazingira,' means 'environment' in Swahili, reflecting our commitment to sustainable tourism and conservation efforts that protect the natural beauty and species of Tanzania.\n\n## Our Story\n\nFounded by local experts with decades of experience, Mazingira Safaris is passionate about sharing the wonder of Tanzania’s ecosystems, culture, and wildlife. We offer a wide range of safari options, from luxury tours to customized excursions, ensuring that every traveler finds their perfect adventure. Our knowledgeable guides, all native to Tanzania, bring authenticity and deep insight to your safari experience, enhancing your understanding and appreciation of the natural world.Our mission is not just to show you Tanzania, but to create a profound connection between our guests and the landscapes we explore. We believe in responsible tourism that supports local communities and contributes to the preservation of wildlife and natural habitats. Join us at Mazingira Safaris for a truly memorable and impactful adventure in the wilds of Tanzania.\n\n# Why Choose Us ?\n\nChoose Mazingira Safaris for an unforgettable, tailor-made safari experience in Tanzania. Every package we offer is custom-built to meet the unique preferences and needs of our customers, ensuring a personalized adventure like no other. With a local Tanzanian at the helm who boasts over 15 years of industry experience, we bring deep, authentic insights and a personal touch to your journey. Our commitment to excellence is reflected in our outstanding 5-star reviews. Plus, as a member of the Tanzania Association of Tour Operators (TATO), we provide added peace of mind, ensuring that your safari is not only spectacular but also secure and reliable. Choose Mazingira Safaris for a truly exceptional exploration of Tanzania’s natural wonders.\n\nRely on us to arrange anything you need. We will withstand a great standard of quality\n\nOur Passionate local Guides, have an incredible set of skills and knowledge to share with you.\n\nGenuine Tanzanian Hospitality. Our team can not wait to plan you perfect safari and welcome you to Tanzania\n\nIncredible 5 Star Reviews from out incredible customers\n\n## Our Partners",
  "images": [
    {
      "src": "https://static.wixstatic.com/media/1ac0ef_6179c700dc0548c7a31bccc08e19cf79~mv2.png",
      "alt": "Mazingira Safaris Eco Friendly Safari Logo"
    },
    {
      "src": "https://static.wixstatic.com/media/1ac0ef_e116fe3aba944f138828156102d8c685~mv2.jpg",
      "alt": "Our Mazingira Safari Truck, with our roof raised on a beautiful sunny day next to one of our camps surrounded by greenery and waiting to take our guests on their full day safari"
    },
    {
      "src": "https://static.wixstatic.com/media/1ac0ef_9c151aa70b2a4ea7b82187af375e3cdcf000.jpg",
      "alt": ""
    },
    {
      "src": "https://static.wixstatic.com/media/1ac0ef_7830ce5a10c74ab6964dc1e3e68f502d~mv2.png",
      "alt": "wine glasses cheers logo"
    },
    {
      "src": "https://static.wixstatic.com/media/1ac0ef_3c4ff79c5106483fa7a0c697b8a25337~mv2.png",
      "alt": "safari truck logo"
    },
    {
      "src": "https://static.wixstatic.com/media/1ac0ef_52bae41a75334f0bbcdaf425a4e3ce4a~mv2.png",
      "alt": "group of people logo"
    }
  ],
  "source": "https://www.mazingirasafari.com/who-is-mazingira"
}
