{
  "id": "about-tanzania",
  "section": "plan",
  "title": "Take a Closer Look",
  "body": "### Seasons\n### Dry: Late Jun - Mid Oct and Late Dec - Mid Mar Wet: Apr-May and Late Oct - Early Dec\n\nFly to\nKilimanjaro, Dar Es Salaam\n\nLanguages\nSwahili, English and > 100 local dialects\n\nCurrency\nTanzanian Shilling (TSH) and USD ($)\n\n#### Explore Tanzania\n\n###### Tanzania stands as the largest country in East Africa, with nearly one-third of its territory designated as protected areas for wildlife conservation. This nation is not only renowned for its iconic safari destinations that draw crowds from around the world, but also for its untouched reserves that offer a genuine wilderness experience.\nThe Serengeti, celebrated for the Great Migration, witnesses nearly 2.5 million wildebeest, zebra, and gazelle traverse its expanse following seasonal rains in a perpetual loop. The most intense part of this migration occurs at the Mara River crossings, where the herds confront hungry crocodiles, territorial hippos, and treacherous waters.\nThe Ngorongoro Crater, formed 2 to 3 million years ago, ranks among East Africa's most wildlife-concentrated regions. Within this ancient caldera, you can spot Thomson's gazelles and wildebeest grazing, lions and leopards on the prowl, and perhaps the rare black rhino lurking in dense vegetation. Beyond the crater's edges, the Maasai coexist with the natural world in a striking balance.\nWhile many visitors are drawn to the well-trodden northern parks, venturing south to the baobab-dotted Ruaha National Park or the expansive, untamed Nyerere National Park (formerly known as Selous Game Reserve) promises a more secluded safari adventure.\nThrilling adventures await: Consider a trip to Rubondo Island National Park in Lake Victoria to search for wild chimpanzees in the forest or embark on a trek up Mount Kilimanjaro, Africa's tallest peak. Afterwards, indulge in a relaxing retreat along the palm-fringed beaches of Zanzibar.\n\n## Most Popular For\n\nBIG CATS & BIG 5\n\nKILIMANJARO\n\nTENTED SAFARI'S\n\nHOT AIR BALLOON SAFARI'S\n\nNIGHT TIME GAME DRIVE\n\n### Ready to start planning your holiday?",
  "images": [
    {
      "src": "https://static.wixstatic.com/media/1ac0ef_6179c700dc0548c7a31bccc08e19cf79~mv2.png",
      "alt": "Mazingira Safaris Eco Friendly Safari Logo"
    },
    {
      "src": "https://static.wixstatic.com/media/11062b_c10ea066c7ff4fb4b761e799ec328e42~mv2_d_5203_3477_s_4_2.jpg",
      "alt": "Zebras in Wild"
    },
    {
      "src": "https://static.wixstatic.com/media/1ac0ef_cb9e0787efc54bbfa7d774a47ee93a8d~mv2.jpg",
      "alt": "Male lion Roaring on a large rock in the Serengeti, you can almost hear the roar from this picture"
    },
    {
      "src": "https://static.wixstatic.com/media/nsplsh_9b3346e45aa24fb39662abd9c4d40ece~mv2.jpg",
      "alt": "A picturesque image of Kilimanjaro against the backdrop of a beautiful blue African sky"
    },
    {
      "src": "https://static.wixstatic.com/media/1ac0ef_648fef6bfffe42c0be9677abb72ba12e~mv2.jpg",
      "alt": "A Camp in Tanzania for Safari Campers, a comfy hard floor camp, surrounded by the ngorongoro crater area"
    },
    {
      "src": "https://static.wixstatic.com/media/1ac0ef_2f54826a054d4310ab783ca28b26b421~mv2.jpg",
      "alt": "serengeti balloon safaris, hot air ballon riding off over the Serengeti plains at sunset"
    }
  ],
  "source": "https://www.mazingirasafari.com/about-tanzania"
}
