{
  "id": "accommodation",
  "section": "plan",
  "title": "Accommodation",
  "body": "Welcome to your gateway to an unforgettable safari adventure in Tanzania. Our carefully curated accommodation page features an extensive selection of over 60 lodges, camps, and hotels, ranging from cozy budget options to opulent luxury retreats located across the stunning landscapes of Tanzania. Each property has been meticulously inspected by our sales team through an annual independent hotel check, ensuring that we consistently offer the highest quality accommodations paired with exceptional service. Whether you're seeking a tranquil escape in the bush or a lavish suite with panoramic views, you'll find the perfect base for your explorations right here. Browse through our list below and click on the links to discover more about each accommodation and what they have to offer for your perfect safari experience. Please note that this is just a small section of what is on offer. Our sales team will work with you to find the best accommodation for you; this list is just a small sample of some of our top picks.\n\n## Nanyukie Lodge\nLemala Authentic Camps\n\nLemala Nanyukie is located a 60-minute drive east of the Seronera Airstrip in the park’s central region, and is superbly located with outstanding views across these fascinating ‘endless plains’. The lodge itself sits on a grassy savanna dotted with rocky kopjes and shaded by ancient giant acacia trees.\n\nEastern Serengeti Tanzania\n\n## Ngorongoro Lodge Meliá Collection\n\nThe Ngorongoro Conservation Area is home to an ecosystem that is unlike any other in Tanzania. Designed with the utmost respect for the environment, this lodge allows you to sleep accompanied by the sounds of nature, wake up admiring the Ngorongoro Crater, and enjoy a truly extraordinary safari experience.\n\nNgorongoro Conservation Area\n\n## Escarpment Luxury Lodge Manyara\n\nPerched high on the rim of the Great Rift Valley Escarpment Luxury Lodge is a serene haven overlooking the wonderful Lake Manyara below. It is only 25 km from the iconic Ngorongoro Crater National Park and a 90-minute drive to Tarangire National Park\n\nLake Manyara\n\n## Gran Meliá Arusha\n\nExperience the essence of Arusha with Gran Meliá. An oasis within Arusha set out on 18 acres of beautiful landscaped coffee and tea plantations. Pure tranquility with spectacular views of Mount Meru. Gran Melia Arusha offers a unique experience combining the most exciting once-in-a-lifetime safari destination with state-of-the-art conference facilities.\n\nArusha Mount Meru View\n\n## Kubu Kubu\nTented Lodge\n\nKubu Kubu Tented Lodge. The Lodge camp is located in Central Serengeti on the slopes of a hill with fantastic views and it is the ideal starting point to visit the great plains at any time of the year. The camp consists of 25 luxury tents with en-suite bathroom. Each tent is a built on a wooden platform. The main house caters with a terrace, restaurant, lounge and swimming pool.\n\nSerengeti National Park\n\n## Ngorongoro Serena Safari Lodge\n\nNestled high above the plains into the Crater’s jagged rim, cloaked in river stone and indigenous vines, Ngorongoro Serena Safari Lodge is barely visible to the naked eye. Framed by arched stone passages and timbered decks, its torch-lit walls are adorned with stylized cave paintings. At the stone heart of the lodge burns a glowing fire, which is kept constantly alight. Rooms are looped around the Crater rim. Each has its own rock-enclosed balcony, and all enjoy completely uninterrupted views of the volcanic amphitheatre far below\n\nNgorongoro Crater Rim\n\n## Anantya Serengeti\n\nExplore the luxurious Anantya Serengeti, a newly built camp nestled in the iconic Serengeti landscape. This upscale destination offers a serene garden, a welcoming bar, and an outdoor fireplace, all under full-day security. Additional amenities include sightseeing tours, a picnic area, and exclusive sundowner spots. Located 35 km from Seronera with airport shuttle service available, Anantya Serengeti offers an unparalleled safari experience\n\nSerengeti\n\n## Farm of Dreams Lodge\n\nFarm of Dream Lodge is home to eight villages with 48 Double Rooms and Superior Rooms built in one of the best spots in the heart of this infamous town of Karatu. The lodge is surrounded by Nature’s bounty; the beautiful flower-lined paths offer an experience with nature, birds singing from Jacaranda trees and flowers that grow to startling sizes and beauty\n\nKaratu (Close to Ngorongoro)\n\n## Nyota Luxury Camps\n\nThe Serengeti fits well into most people’s dream of an African safari, with its abundant wildlife, vast golden plains, iconic acacia trees and kopjes. Nyota Luxury Tented Camp is nestled in the heart of the Serengeti and we are blessed to have the Orangi river meandering along our camp’s borders. Nyota (rhyme it with water) means ‘stars’ in Swahili.\n\nSeronera Serengeti",
  "images": [
    {
      "src": "https://static.wixstatic.com/media/1ac0ef_6179c700dc0548c7a31bccc08e19cf79~mv2.png",
      "alt": "Mazingira Safaris Eco Friendly Safari Logo"
    },
    {
      "src": "https://static.wixstatic.com/media/1ac0ef_6f4db7ce1181487a9a2a32da47e70820~mv2.jpeg",
      "alt": "lemala Nanyukie Sunset at a tanzania safari camp"
    },
    {
      "src": "https://static.wixstatic.com/media/1ac0ef_6f0c56754b3744f2a7922540f3aca876~mv2.png",
      "alt": "Nanyukie Lodge Lemala Authentic Camps, dining area looking out over the eastern Serengeti"
    },
    {
      "src": "https://static.wixstatic.com/media/1ac0ef_160373e1f6b94477b704052d73ef9c18~mv2.jpg",
      "alt": "Ngorongoro Lodge Meliá Collection, a double room with floor to ceiling window view looking over the Ngorongoro crater"
    },
    {
      "src": "https://static.wixstatic.com/media/1ac0ef_3ed794210aeb47ee83764ed0c1906b3c~mv2.jpg",
      "alt": "Escarpment Luxury Lodge Manyara, a double room with balcony looking out over Lake Manyara"
    },
    {
      "src": "https://static.wixstatic.com/media/1ac0ef_008c4d5ae011492f972e3449747d9b78~mv2.jpg",
      "alt": "Gran Meliá Arusha, pool area surrounded by luxurious green gardens a paradise with view over the mountain"
    }
  ],
  "source": "https://www.mazingirasafari.com/accommodation"
}
