{
  "id": "how-to-plan-the-perfect-safari-honeymoon-in-tanzania-and-zanzibar",
  "section": "plan",
  "title": "How to Plan the Perfect Safari Honeymoon in Tanzania and Zanzibar",
  "body": "A honeymoon is a once-in-a-lifetime experience, and there’s no better way to start your life together than with an adventure that combines the wild beauty of Tanzania’s safaris with the idyllic beaches of Zanzibar. Tanzania offers unparalleled wildlife encounters, while Zanzibar provides stunning white-sand beaches and crystal-clear waters. Here’s how to plan the perfect safari and beach honeymoon that balances romance, adventure, and relaxation.\n\n1. Choose Your Safari Destination in Tanzania\n\nTanzania is renowned for its wildlife and iconic safari destinations, making it the perfect start to your honeymoon. Each park offers something unique, so consider these options for your safari:\n\nSerengeti National Park: Famous for the Great Migration, where millions of wildebeest and zebras thunder across the plains. This is ideal if you want to witness one of nature’s greatest spectacles.\n\nNgorongoro Crater: Known as Africa’s \"Garden of Eden,\" the crater is a UNESCO World Heritage site and offers the chance to see the Big Five in one breathtaking location.\n\nTarangire National Park: For couples who love elephants and quieter parks, Tarangire is a hidden gem with fewer crowds and large herds of elephants alongside baobab-dotted landscapes.\n\nAt Mazingira Safaris, we can help you design a custom itinerary that fits your dream honeymoon. You’ll have a private guide and vehicle, ensuring an intimate experience just for the two of you. Consider adding extra romantic touches, like a private sunset game drive followed by a bush dinner under the stars.\n\n2. Romantic Safari Experiences to Include\n\nMake your honeymoon safari extra special by adding unique experiences that will create unforgettable memories:\n\nHot Air Balloon Safari: Drift over the Serengeti at dawn, watching wildlife from above with a glass of champagne in hand. It’s an exhilarating yet peaceful way to begin a new day together.\n\nNight Game Drives: Explore the wilderness under the moonlight and experience the nocturnal side of Tanzania. Lions, leopards, and other predators often hunt at night, adding excitement to your honeymoon.\n\nPrivate Bush Dinners: After a thrilling day of wildlife viewing, you can end the evening with a private dinner in the heart of the bush. Just you, your partner, and the distant sounds of Africa’s wildlife as your backdrop.\n\nCoffee Plantation or Maasai Village Visits: Immerse yourselves in Tanzania’s rich culture by visiting a coffee plantation or engaging with the local Maasai people. It’s a beautiful way to deepen your connection to the land and its people.\n\n3. Wind Down in Zanzibar\n\nAfter the adventure of the Tanzanian bush, head to Zanzibar for the ultimate beach escape. Zanzibar is a tropical paradise known for its powdery white sand, turquoise waters, and luxurious resorts. Here’s how to make the most of your beach honeymoon:\n\nRelax on the Beach: Zanzibar's beaches are the perfect place to unwind after your safari. Spend your days lounging in hammocks, sipping cocktails, or taking leisurely walks along the shore.\n\nSnorkeling and Diving: If you’re an adventurous couple, take advantage of Zanzibar’s vibrant coral reefs. Mnemba Atoll is a popular spot for snorkeling and diving, where you can explore a colorful underwater world.\n\nPrivate Sunset Cruises: Nothing says romance like a sunset dhow cruise along the coast. Enjoy a peaceful sail as the sun dips below the horizon, painting the sky in shades of orange and pink.\n\nSpa Treatments: Pamper yourselves with a couples’ spa treatment. Many resorts in Zanzibar offer world-class spa services in serene settings, from open-air massage huts to luxurious indoor treatments.\n\n4. Selecting the Right Accommodations\n\nLuxury accommodations are key to a honeymoon, and Tanzania and Zanzibar have some of the finest options available.\n\nSafari Lodges and Camps: Choose a luxury tented camp or lodge that offers private, romantic settings. Opt for lodges with honeymoon suites that feature outdoor showers, plunge pools, and views of the savannah or waterholes where animals gather.\n\nBeach Resorts: In Zanzibar, you’ll find plenty of luxurious beachfront resorts with private villas, infinity pools, and butler services. For a romantic escape, consider resorts in secluded areas like Matemwe or Pongwe, where you can enjoy the peace and quiet.\n\nAt Mazingira Safaris, we partner with premium safari camps and beach resorts to ensure your accommodations match the luxury and romance you’re seeking. We can help you select properties that suit your style, from tented camps with star-lit dinners to oceanfront villas with private beach access.\n\n5. Timing Your Honeymoon\n\nThe best time for a safari honeymoon in Tanzania depends on what you want to experience:\n\nJune to October: The dry season is ideal for wildlife viewing. During this time, animals gather around waterholes, making it easier to spot them. This is also the best time to witness the Great Migration.\n\nNovember to March: The wet season brings fewer crowds, and the landscape is lush and green. This time of year is great for birdwatching and seeing baby animals.\n\nFor Zanzibar, the best beach weather is from June to October or from December to March, when the temperatures are warm, and the skies are clear.\n\n6. Seamless Planning with Mazingira Safaris\n\nPlanning your honeymoon with Mazingira Safaris means you can relax while we take care of all the details. From booking the perfect accommodations to creating a custom itinerary filled with romantic experiences, we’ll ensure your honeymoon is stress-free and unforgettable.\n\nWe specialize in creating private, customizable safaris that cater to your preferences. Whether you want to focus on wildlife, culture, relaxation, or all of the above, we can design the trip of your dreams. Plus, with our expert guides and luxury accommodations, your honeymoon will be one for the books.\n\nConclusion\n\nA honeymoon that combines the excitement of a safari with the tranquility of a beach getaway is the perfect way to start your life together. With Tanzania’s iconic wildlife and Zanzibar’s stunning beaches, you’ll have the best of both worlds. Let Mazingira Safaris create a seamless, personalized experience that blends adventure, romance, and relaxation into one unforgettable trip.",
  "images": [
    {
      "src": "https://static.wixstatic.com/media/1ac0ef_6179c700dc0548c7a31bccc08e19cf79~mv2.png",
      "alt": "Mazingira Safaris Eco Friendly Safari Logo"
    },
    {
      "src": "https://static.wixstatic.com/media/1ac0ef_315b51f5fa6e4a3aafbc752ed4d4d522~mv2.jpg",
      "alt": ""
    },
    {
      "src": "https://static.wixstatic.com/media/1ac0ef_206afa28b9d047c295778d90c033ff96~mv2.jpg",
      "alt": ""
    },
    {
      "src": "https://static.wixstatic.com/media/1ac0ef_0abc1e2f791144cd97780d864aeeb1ec~mv2.png",
      "alt": ""
    }
  ],
  "source": "https://www.mazingirasafari.com/post/how-to-plan-the-perfect-safari-honeymoon-in-tanzania-and-zanzibar"
}
