{
  "id": "kilimanjaro-routes",
  "section": "kilimanjaro",
  "title": "Kilimanjaro Routes",
  "body": "Welcome to our comprehensive guide to the various climbing routes of Mount Kilimanjaro! Each route presents a unique blend of adventure, breathtaking landscapes, and distinct challenges, offering something for every type of trekker. Whether you're drawn to the lush, densely vegetated paths of the Machame route, the gentle slopes and scenic beauty of the Marangu route, or the rugged and remote trails of Lemosho and Rongai, there's a path that perfectly suits your preferences and fitness level. Explore the options below to discover the route that will lead you to an unforgettable summit experience on Africa's highest peak.\n\n# Machame route\n\nDistance covered: 63km\nMachame route: minimum of six days\nThe Machame route is often regarded as one of the most stunning ways to reach the summit, offering incredible views but depending heavily on weather conditions. Located on the mountain's southern side, it faces the wind and experiences heavier rainfall, resulting in denser vegetation.\nThis route is steeper than the Marangu and Rongai routes and is more physically challenging, yet excellent for acclimatization. It merges with the Lemosho route at New Shira Camp. The Machame route, also known as the 'whiskey route,' is the preferred choice of about 60% of our guests. Descent is made via the Mweka route, making this option ideal for hikers in relatively good physical condition.\n\n# Lemosho route\n\nDistance covered: 70km\nLemosho route: minimum of 7-8 days\nShira was the original version of the Lemosho route, while Lemosho is now the refined alternative. Starting at the Londorossi Gate on Kilimanjaro's quieter western side, it initially winds through a lush rainforest for the first two days before reaching a picturesque heath zone abundant with Ericas. Over eight days, this is the longest route to the summit and parallels the Machame route from the third day onward. While it's challenging, this route is ideal for acclimatization, and it's considered tougher than the Marangu and Rongai routes.\n\n# Marangu route\n\nDistance covered: 69km\nMarangu route: minimum of 5-6days\nThe Marangu route, known as the \"Coca Cola\" route, is the oldest and often considered the easiest path to the summit. It approaches Kilimanjaro from the southeast, leading climbers through lush rainforests and scenic moorlands. With a steady and moderate ascent, this route offers a relatively relaxed trekking experience compared to other routes, making it suitable for those concerned about their fitness. Despite its well-maintained paths and gentle gradients, the consistent ascent provides less opportunity for acclimatization.\nUnlike other routes, climbers overnight in mountain huts that offer protection from the elements rather than camping in tents. The ascent and descent follow the same path, so you'll frequently encounter other groups traveling in the opposite direction.\n\n# Rongai route\n\nDistance covered: 69km\nRongai route: minimum of 5-6days\nThe Rongai route, starting near the Kenyan border on Kilimanjaro's northeastern side, is remote and requires a lengthy drive to reach its starting point. Approaching from the north, this route is often drier during the rainy season and provides a moderate acclimatization profile.\nAlthough less crowded than other routes, it features a moderately steep ascent, passing through an impressive alpine desert with scenic views of Kenya and the Kibo summit. Trekkers following this route will return via the Marangu route.\n.",
  "images": [
    {
      "src": "https://static.wixstatic.com/media/1ac0ef_6179c700dc0548c7a31bccc08e19cf79~mv2.png",
      "alt": "Mazingira Safaris Eco Friendly Safari Logo"
    },
    {
      "src": "https://static.wixstatic.com/media/1ac0ef_51219f3d4ea04f26b2118fefad01a809~mv2.png",
      "alt": "Screenshot 2024-05-12 at 00.46.33.png"
    },
    {
      "src": "https://static.wixstatic.com/media/1ac0ef_c7655664c89845d4941ee02c9bae2980~mv2.png",
      "alt": "Machame Route Kilimanjaro Map"
    },
    {
      "src": "https://static.wixstatic.com/media/1ac0ef_7466d58c33dc48afa00f31abb64d7aea~mv2.png",
      "alt": "Lemosho Route Kilimanjaro Map"
    },
    {
      "src": "https://static.wixstatic.com/media/1ac0ef_0fc95d115873469e8c5713ae58dee1c9~mv2.png",
      "alt": "Marangu Route Kilimanjaro Map"
    },
    {
      "src": "https://static.wixstatic.com/media/1ac0ef_cc5e0dbc5e6f49d991034308cdf68460~mv2.png",
      "alt": "Rongai Route Kilimanjaro Map"
    }
  ],
  "source": "https://www.mazingirasafari.com/kilimanjaro-routes"
}
